{
  "$schema": "https://json-schema.org/draft/2020-12/schema",
  "$id": "https://github.com/oldwinter/obsidian-nautilus-log/blob/main/docs/parity/requirement-owners.schema.json",
  "title": "Spiral Day parity requirement ownership map",
  "type": "object",
  "additionalProperties": false,
  "required": ["$schema", "schema_version", "requirement_set", "row_count", "requirements"],
  "properties": {
    "$schema": { "const": "./requirement-owners.schema.json" },
    "schema_version": { "const": 1 },
    "requirement_set": { "const": "UPSTREAM-MATRIX-v1+INITIAL-OBS-REL-v1" },
    "row_count": { "const": 126 },
    "requirements": {
      "type": "array",
      "minItems": 126,
      "maxItems": 126,
      "items": { "$ref": "#/$defs/ownership" }
    }
  },
  "$defs": {
    "ownership": {
      "type": "object",
      "additionalProperties": false,
      "required": ["id", "owner_ticket", "owner_module"],
      "properties": {
        "id": {
          "type": "string",
          "pattern": "^(UP-(INS|SET|PAR|SCH|DAY|HIS|VIS|CTL|CMP|EXE|CLK|CMD|PER|ERR|ERX|DRF)-[0-9]{2}|OBS-(TRACE|HOST|VIS|A11Y|SAFE|LIFE|I18N|LOCAL)-[0-9]{3}|REL-[0-9]{3})$"
        },
        "owner_ticket": { "type": "integer", "minimum": 17, "maximum": 31 },
        "owner_module": { "type": "string", "minLength": 1 },
        "evidence_contributors": {
          "type": "array",
          "uniqueItems": true,
          "items": { "type": "integer", "minimum": 17, "maximum": 31 }
        }
      }
    }
  }
}
