{
  "$schema": "./requirement-owners.schema.json",
  "schema_version": 1,
  "requirement_set": "UPSTREAM-MATRIX-v1+INITIAL-OBS-REL-v1",
  "row_count": 126,
  "requirements": [
    {
      "id": "UP-INS-01",
      "owner_ticket": 17,
      "owner_module": "README.md",
      "evidence_contributors": [
        22,
        30
      ]
    },
    {
      "id": "UP-INS-02",
      "owner_ticket": 27,
      "owner_module": "src/main.ts",
      "evidence_contributors": [
        17,
        22,
        30
      ]
    },
    {
      "id": "UP-INS-03",
      "owner_ticket": 24,
      "owner_module": "src/ui/planner/view.ts",
      "evidence_contributors": [
        17,
        21,
        23,
        30
      ]
    },
    {
      "id": "UP-INS-04",
      "owner_ticket": 21,
      "owner_module": "src/runtime/lifecycle.ts",
      "evidence_contributors": [
        17,
        23,
        30
      ]
    },
    {
      "id": "UP-INS-05",
      "owner_ticket": 21,
      "owner_module": "src/runtime/lifecycle.ts",
      "evidence_contributors": [
        17,
        23,
        30
      ]
    },
    {
      "id": "UP-SET-01",
      "owner_ticket": 27,
      "owner_module": "src/adapters/settings.ts",
      "evidence_contributors": [
        21,
        24,
        26,
        30
      ]
    },
    {
      "id": "UP-SET-02",
      "owner_ticket": 27,
      "owner_module": "src/adapters/settings.ts",
      "evidence_contributors": [
        21,
        24,
        26,
        30
      ]
    },
    {
      "id": "UP-SET-03",
      "owner_ticket": 27,
      "owner_module": "src/adapters/settings.ts",
      "evidence_contributors": [
        21,
        24,
        26,
        30
      ]
    },
    {
      "id": "UP-SET-04",
      "owner_ticket": 27,
      "owner_module": "src/adapters/settings.ts",
      "evidence_contributors": [
        21,
        24,
        26,
        30
      ]
    },
    {
      "id": "UP-SET-05",
      "owner_ticket": 27,
      "owner_module": "src/adapters/settings.ts",
      "evidence_contributors": [
        21,
        24,
        26,
        30
      ]
    },
    {
      "id": "UP-SET-06",
      "owner_ticket": 27,
      "owner_module": "src/adapters/settings.ts",
      "evidence_contributors": [
        21,
        24,
        26,
        30
      ]
    },
    {
      "id": "UP-SET-07",
      "owner_ticket": 27,
      "owner_module": "src/adapters/settings.ts",
      "evidence_contributors": [
        21,
        24,
        26,
        30
      ]
    },
    {
      "id": "UP-SET-08",
      "owner_ticket": 27,
      "owner_module": "src/adapters/settings.ts",
      "evidence_contributors": [
        21,
        24,
        26,
        30
      ]
    },
    {
      "id": "UP-SET-09",
      "owner_ticket": 27,
      "owner_module": "src/adapters/settings.ts",
      "evidence_contributors": [
        21,
        24,
        26,
        30
      ]
    },
    {
      "id": "UP-SET-10",
      "owner_ticket": 27,
      "owner_module": "src/adapters/settings.ts",
      "evidence_contributors": [
        21,
        24,
        26,
        30
      ]
    },
    {
      "id": "UP-SET-11",
      "owner_ticket": 27,
      "owner_module": "src/adapters/settings.ts",
      "evidence_contributors": [
        21,
        24,
        26,
        30
      ]
    },
    {
      "id": "UP-SET-12",
      "owner_ticket": 27,
      "owner_module": "src/adapters/settings.ts",
      "evidence_contributors": [
        21,
        24,
        26,
        30
      ]
    },
    {
      "id": "UP-SET-13",
      "owner_ticket": 27,
      "owner_module": "src/adapters/settings.ts",
      "evidence_contributors": [
        21,
        24,
        26,
        30
      ]
    },
    {
      "id": "UP-PAR-01",
      "owner_ticket": 18,
      "owner_module": "src/core/grammar-v1.ts",
      "evidence_contributors": [
        20,
        22
      ]
    },
    {
      "id": "UP-PAR-02",
      "owner_ticket": 18,
      "owner_module": "src/core/grammar-v1.ts",
      "evidence_contributors": [
        20,
        22
      ]
    },
    {
      "id": "UP-PAR-03",
      "owner_ticket": 18,
      "owner_module": "src/core/grammar-v1.ts",
      "evidence_contributors": [
        20,
        22
      ]
    },
    {
      "id": "UP-PAR-04",
      "owner_ticket": 18,
      "owner_module": "src/core/grammar-v1.ts",
      "evidence_contributors": [
        20,
        22
      ]
    },
    {
      "id": "UP-PAR-05",
      "owner_ticket": 18,
      "owner_module": "src/core/grammar-v1.ts",
      "evidence_contributors": [
        20,
        22
      ]
    },
    {
      "id": "UP-PAR-06",
      "owner_ticket": 18,
      "owner_module": "src/core/grammar-v1.ts",
      "evidence_contributors": [
        20,
        22
      ]
    },
    {
      "id": "UP-PAR-07",
      "owner_ticket": 18,
      "owner_module": "src/core/grammar-v1.ts",
      "evidence_contributors": [
        20,
        22
      ]
    },
    {
      "id": "UP-PAR-08",
      "owner_ticket": 18,
      "owner_module": "src/core/grammar-v1.ts",
      "evidence_contributors": [
        20,
        22
      ]
    },
    {
      "id": "UP-PAR-09",
      "owner_ticket": 18,
      "owner_module": "src/core/grammar-v1.ts",
      "evidence_contributors": [
        20,
        22
      ]
    },
    {
      "id": "UP-PAR-10",
      "owner_ticket": 18,
      "owner_module": "src/core/grammar-v1.ts",
      "evidence_contributors": [
        20,
        22
      ]
    },
    {
      "id": "UP-PAR-11",
      "owner_ticket": 18,
      "owner_module": "src/core/grammar-v1.ts",
      "evidence_contributors": [
        20,
        22
      ]
    },
    {
      "id": "UP-PAR-12",
      "owner_ticket": 18,
      "owner_module": "src/core/grammar-v1.ts",
      "evidence_contributors": [
        20,
        22
      ]
    },
    {
      "id": "UP-SCH-01",
      "owner_ticket": 19,
      "owner_module": "src/core/scheduler.ts",
      "evidence_contributors": [
        22,
        23
      ]
    },
    {
      "id": "UP-SCH-02",
      "owner_ticket": 19,
      "owner_module": "src/core/scheduler.ts",
      "evidence_contributors": [
        22,
        23
      ]
    },
    {
      "id": "UP-SCH-03",
      "owner_ticket": 19,
      "owner_module": "src/core/scheduler.ts",
      "evidence_contributors": [
        22,
        23
      ]
    },
    {
      "id": "UP-SCH-04",
      "owner_ticket": 19,
      "owner_module": "src/core/scheduler.ts",
      "evidence_contributors": [
        22,
        23
      ]
    },
    {
      "id": "UP-SCH-05",
      "owner_ticket": 19,
      "owner_module": "src/core/scheduler.ts",
      "evidence_contributors": [
        22,
        23
      ]
    },
    {
      "id": "UP-SCH-06",
      "owner_ticket": 19,
      "owner_module": "src/core/scheduler.ts",
      "evidence_contributors": [
        22,
        23
      ]
    },
    {
      "id": "UP-SCH-07",
      "owner_ticket": 19,
      "owner_module": "src/core/scheduler.ts",
      "evidence_contributors": [
        22,
        23
      ]
    },
    {
      "id": "UP-DAY-01",
      "owner_ticket": 19,
      "owner_module": "src/core/day.ts",
      "evidence_contributors": [
        21,
        23
      ]
    },
    {
      "id": "UP-DAY-02",
      "owner_ticket": 19,
      "owner_module": "src/core/day.ts",
      "evidence_contributors": [
        21,
        23
      ]
    },
    {
      "id": "UP-DAY-03",
      "owner_ticket": 19,
      "owner_module": "src/core/day.ts",
      "evidence_contributors": [
        21,
        23
      ]
    },
    {
      "id": "UP-DAY-04",
      "owner_ticket": 19,
      "owner_module": "src/core/day.ts",
      "evidence_contributors": [
        21,
        23
      ]
    },
    {
      "id": "UP-HIS-01",
      "owner_ticket": 28,
      "owner_module": "src/workspace/history-index.ts",
      "evidence_contributors": [
        19,
        20,
        29
      ]
    },
    {
      "id": "UP-HIS-02",
      "owner_ticket": 28,
      "owner_module": "src/workspace/history-index.ts",
      "evidence_contributors": [
        19,
        20,
        29
      ]
    },
    {
      "id": "UP-HIS-03",
      "owner_ticket": 28,
      "owner_module": "src/workspace/history-index.ts",
      "evidence_contributors": [
        19,
        20,
        29
      ]
    },
    {
      "id": "UP-HIS-04",
      "owner_ticket": 28,
      "owner_module": "src/workspace/history-index.ts",
      "evidence_contributors": [
        19,
        20,
        29
      ]
    },
    {
      "id": "UP-HIS-05",
      "owner_ticket": 28,
      "owner_module": "src/workspace/history-index.ts",
      "evidence_contributors": [
        19,
        20,
        29
      ]
    },
    {
      "id": "UP-VIS-01",
      "owner_ticket": 23,
      "owner_module": "src/ui/planner/spiral.ts",
      "evidence_contributors": [
        22,
        24,
        30
      ]
    },
    {
      "id": "UP-VIS-02",
      "owner_ticket": 23,
      "owner_module": "src/ui/planner/spiral.ts",
      "evidence_contributors": [
        22,
        24,
        30
      ]
    },
    {
      "id": "UP-VIS-03",
      "owner_ticket": 23,
      "owner_module": "src/ui/planner/spiral.ts",
      "evidence_contributors": [
        22,
        24,
        30
      ]
    },
    {
      "id": "UP-VIS-04",
      "owner_ticket": 23,
      "owner_module": "src/ui/planner/spiral.ts",
      "evidence_contributors": [
        22,
        24,
        30
      ]
    },
    {
      "id": "UP-VIS-06",
      "owner_ticket": 23,
      "owner_module": "src/ui/planner/spiral.ts",
      "evidence_contributors": [
        22,
        24,
        30
      ]
    },
    {
      "id": "UP-VIS-07",
      "owner_ticket": 23,
      "owner_module": "src/ui/planner/spiral.ts",
      "evidence_contributors": [
        22,
        24,
        30
      ]
    },
    {
      "id": "UP-CTL-01",
      "owner_ticket": 24,
      "owner_module": "src/ui/planner/controls.ts",
      "evidence_contributors": [